{
  "schema_version": "0.1.0",
  "project": {
    "id": "synthetic-lab-platform",
    "name": "Synthetic Lab Platform",
    "description": "A fictional project timeline used to demonstrate decision drift."
  },
  "review_date": "2026-08-01",
  "decisions": [
    {
      "id": "decision-local-store",
      "title": "Use SQLite for experiment metadata",
      "made_at": "2026-01-10",
      "status": "ACTIVE",
      "choice": "Store experiment metadata in a local SQLite database.",
      "rationale": "The prototype had one writer, under 100 MB of metadata, and no cloud synchronization requirement.",
      "owner": "Synthetic Platform Team",
      "reversibility": "medium",
      "next_review_at": "2026-05-15",
      "assumptions": [
        {
          "id": "assumption-single-writer",
          "statement": "Only one process writes experiment metadata at a time.",
          "source": "explicit",
          "confidence": "high",
          "state": "holding"
        },
        {
          "id": "assumption-small-data",
          "statement": "Metadata remains below 1 GB during the prototype phase.",
          "source": "explicit",
          "confidence": "medium",
          "state": "holding"
        }
      ],
      "evidence": [
        {
          "id": "evidence-january-load-test",
          "kind": "synthetic benchmark",
          "source": "synthetic://benchmarks/2026-01-load-test",
          "observed_at": "2026-01-09",
          "expires_after_days": 120,
          "supports": ["assumption-single-writer", "assumption-small-data"]
        }
      ],
      "alternatives": [
        {
          "id": "alternative-postgresql",
          "label": "Move metadata to PostgreSQL",
          "rejected_because": "Operational overhead was unnecessary for a single-user prototype.",
          "reopen_when": ["rule-multiple-writers", "rule-data-growth"]
        }
      ],
      "predictions": [
        {
          "id": "prediction-metadata-latency",
          "metric": "p95 metadata write latency",
          "lower": 40,
          "upper": 60,
          "unit": "ms",
          "due_at": "2026-07-01",
          "actual": 85,
          "actual_observed_at": "2026-07-01"
        }
      ],
      "rules": [
        {
          "id": "rule-multiple-writers",
          "assumption_id": "assumption-single-writer",
          "fact": "team.concurrent_writers",
          "operator": "gt",
          "value": 1,
          "severity": "invalidate",
          "message": "The local storage choice assumed a single writer."
        },
        {
          "id": "rule-data-growth",
          "assumption_id": "assumption-small-data",
          "fact": "data.metadata_size_gb",
          "operator": "gte",
          "value": 1,
          "severity": "warning",
          "message": "Metadata reached the review threshold recorded in the original decision."
        }
      ],
      "next_actions": [
        "Run a 30-minute concurrent-write benchmark on the current workload.",
        "Compare migration cost and operational burden before changing storage."
      ]
    },
    {
      "id": "decision-small-model",
      "title": "Use a compact model for triage",
      "made_at": "2026-02-20",
      "status": "ACTIVE",
      "choice": "Use a compact model for first-pass issue triage.",
      "rationale": "The larger model exceeded the project's cost ceiling in February.",
      "owner": "Synthetic ML Team",
      "reversibility": "easy",
      "next_review_at": "2026-09-01",
      "assumptions": [
        {
          "id": "assumption-frontier-cost",
          "statement": "A larger model costs at least $2 per million input tokens.",
          "source": "explicit",
          "confidence": "medium",
          "state": "holding"
        }
      ],
      "evidence": [
        {
          "id": "evidence-february-price-sheet",
          "kind": "synthetic price snapshot",
          "source": "synthetic://pricing/2026-02",
          "observed_at": "2026-02-19",
          "expires_after_days": 365,
          "supports": ["assumption-frontier-cost"]
        }
      ],
      "alternatives": [
        {
          "id": "alternative-larger-model",
          "label": "Re-evaluate a larger model for difficult cases",
          "rejected_because": "It exceeded the recorded input-token cost ceiling.",
          "reopen_when": ["rule-frontier-price-drop"]
        }
      ],
      "predictions": [
        {
          "id": "prediction-ticket-reduction",
          "metric": "manual triage reduction",
          "lower": 20,
          "upper": 30,
          "unit": "percent",
          "due_at": "2026-06-01",
          "actual": 26,
          "actual_observed_at": "2026-06-01"
        }
      ],
      "rules": [
        {
          "id": "rule-frontier-price-drop",
          "assumption_id": "assumption-frontier-cost",
          "fact": "model.frontier_input_cost_per_million_usd",
          "operator": "lt",
          "value": 2,
          "severity": "warning",
          "message": "The cost reason for rejecting a larger model may no longer hold."
        }
      ],
      "next_actions": [
        "Benchmark the compact and larger model on the same 100 synthetic issues."
      ]
    },
    {
      "id": "decision-drop-metric",
      "title": "Exclude recovery time from the dashboard",
      "made_at": "2026-03-05",
      "status": "ACTIVE",
      "choice": "Omit recovery time because the initial pilot found high measurement noise.",
      "rationale": "The metric did not separate synthetic groups in the first pilot.",
      "owner": "Synthetic Research Team",
      "reversibility": "easy",
      "next_review_at": "2026-07-15",
      "assumptions": [
        {
          "id": "assumption-metric-uninformative",
          "statement": "Recovery time has no useful predictive value under the revised protocol.",
          "source": "inferred",
          "confidence": "low",
          "state": "unknown"
        }
      ],
      "evidence": [
        {
          "id": "evidence-initial-pilot",
          "kind": "synthetic pilot",
          "source": "synthetic://experiments/pilot-01",
          "observed_at": "2026-03-01",
          "supports": ["assumption-metric-uninformative"]
        }
      ],
      "alternatives": [
        {
          "id": "alternative-reintroduce-metric",
          "label": "Reintroduce recovery time with repeated measurements",
          "rejected_because": "The first pilot showed high noise and no separation.",
          "reopen_when": ["rule-new-metric-evidence"]
        }
      ],
      "predictions": [],
      "rules": [
        {
          "id": "rule-new-metric-evidence",
          "assumption_id": "assumption-metric-uninformative",
          "fact": "literature.recovery_metric_supported",
          "operator": "eq",
          "value": true,
          "severity": "invalidate",
          "message": "New evidence directly challenges the premise used to omit the metric."
        },
        {
          "id": "rule-reliability-improved",
          "assumption_id": "assumption-metric-uninformative",
          "fact": "experiment.recovery_metric_icc",
          "operator": "gte",
          "value": 0.8,
          "severity": "warning",
          "message": "Reliability may now be high enough to retest predictive value."
        }
      ],
      "next_actions": [
        "Read the cited method section before treating the external result as transferable.",
        "Run a blinded repeated-measurement reliability pilot."
      ]
    }
  ]
}
